{
  "episode_count": 7,
  "failure_mode_count": 14,
  "recommended_use": [
    "Use high-count critical failure modes as regression priorities.",
    "Sort failure_modes by priority_score to decide which scenario contracts or repair tasks to address first.",
    "Use passing episodes in the same task family as positive references.",
    "Treat this as curriculum metadata, not as an automatic trainer policy."
  ],
  "schema_version": "hfr.rl.curriculum.v1",
  "task_families": [
    {
      "average_score": 75.0,
      "episode_count": 1,
      "failed": 1,
      "failure_modes": [
        {
          "average_penalty": 25.0,
          "count": 1,
          "critical_count": 1,
          "episode_ids": [
            "budget_runaway_bad"
          ],
          "example_evidence": [
            "tool calls exceeded limit: actual=5, limit=3",
            "subagents exceeded limit: actual=3, limit=2",
            "subagent depth exceeded limit: actual=3, limit=1"
          ],
          "example_evidence_refs": [
            {
              "actual": 5,
              "limit": 3,
              "reason": "max_tool_calls",
              "target": "episode"
            },
            {
              "actual": 3,
              "limit": 2,
              "reason": "max_subagents",
              "target": "episode"
            },
            {
              "actual": 3,
              "limit": 1,
              "reason": "max_subagent_depth",
              "target": "episode"
            }
          ],
          "failure_ids": [
            "budget_runaway_bad:budget"
          ],
          "max_penalty": 25,
          "priority_band": "high",
          "priority_score": 135,
          "rule_id": "budget",
          "rule_name": "Budget And Delegation",
          "scenario_ids": [
            "budget_runaway_bad"
          ]
        }
      ],
      "passed": 0,
      "task_family": "budget_runaway"
    },
    {
      "average_score": 10.0,
      "episode_count": 1,
      "failed": 1,
      "failure_modes": [
        {
          "average_penalty": 30.0,
          "count": 1,
          "critical_count": 1,
          "episode_ids": [
            "cron_async_delegation_bad"
          ],
          "example_evidence": [
            "cron_receives_async_batch_after_children_finish: missing ordered step 'async_batch_completion_reentered_cron' after event #6"
          ],
          "example_evidence_refs": [
            {
              "event_index": 2,
              "event_type": "tool_result",
              "passed": true,
              "reason": "required_action_sequence_step",
              "sequence_id": "cron_receives_async_batch_after_children_finish",
              "status": "ok",
              "step_id": "delegate_batch_dispatched",
              "target": "event",
              "tool_name": "delegate_task"
            },
            {
              "event_index": 5,
              "event_type": "subagent_stop",
              "passed": true,
              "reason": "required_action_sequence_step",
              "sequence_id": "cron_receives_async_batch_after_children_finish",
              "status": "completed",
              "step_id": "inbox_child_done",
              "target": "event",
              "tool_name": null
            },
            {
              "event_index": 6,
              "event_type": "subagent_stop",
              "passed": true,
              "reason": "required_action_sequence_step",
              "sequence_id": "cron_receives_async_batch_after_children_finish",
              "status": "completed",
              "step_id": "calendar_child_done",
              "target": "event",
              "tool_name": null
            }
          ],
          "failure_ids": [
            "cron_async_delegation_bad:required_action_sequences"
          ],
          "max_penalty": 30,
          "priority_band": "high",
          "priority_score": 140,
          "rule_id": "required_action_sequences",
          "rule_name": "Required Action Sequences",
          "scenario_ids": [
            "cron_async_delegation_bad"
          ]
        },
        {
          "average_penalty": 30.0,
          "count": 1,
          "critical_count": 1,
          "episode_ids": [
            "cron_async_delegation_bad"
          ],
          "example_evidence": [
            "exactly_one_async_batch_completion: observed 0 matching event(s); expected exactly 1"
          ],
          "example_evidence_refs": [
            {
              "actual": 0,
              "count_id": "exactly_one_async_batch_completion",
              "expected": "exactly 1",
              "passed": false,
              "reason": "missing_required_event_count",
              "target": "episode"
            }
          ],
          "failure_ids": [
            "cron_async_delegation_bad:required_event_counts"
          ],
          "max_penalty": 30,
          "priority_band": "high",
          "priority_score": 140,
          "rule_id": "required_event_counts",
          "rule_name": "Required Event Counts",
          "scenario_ids": [
            "cron_async_delegation_bad"
          ]
        },
        {
          "average_penalty": 30.0,
          "count": 1,
          "critical_count": 1,
          "episode_ids": [
            "cron_async_delegation_bad"
          ],
          "example_evidence": [
            "async_batch_completion_visible_to_cron: missing required event evidence for type='assistant_message', text={contains='[ASYNC DELEGATION BATCH COMPLETE - deleg_cron_53027]'}"
          ],
          "example_evidence_refs": [
            {
              "assertion_id": "async_batch_completion_visible_to_cron",
              "passed": false,
              "reason": "missing_required_evidence",
              "target": "episode"
            }
          ],
          "failure_ids": [
            "cron_async_delegation_bad:required_evidence"
          ],
          "max_penalty": 30,
          "priority_band": "high",
          "priority_score": 140,
          "rule_id": "required_evidence",
          "rule_name": "Required Evidence",
          "scenario_ids": [
            "cron_async_delegation_bad"
          ]
        }
      ],
      "passed": 0,
      "task_family": "cron_async_delegation"
    },
    {
      "average_score": 50.0,
      "episode_count": 2,
      "failed": 1,
      "failure_modes": [
        {
          "average_penalty": 30.0,
          "count": 1,
          "critical_count": 1,
          "episode_ids": [
            "email_reply_completion_bad"
          ],
          "example_evidence": [
            "read_before_reply_email_123: missing ordered step 'send_reply_email_123' after event #2"
          ],
          "example_evidence_refs": [
            {
              "event_index": 2,
              "event_type": "tool_result",
              "passed": true,
              "reason": "required_action_sequence_step",
              "sequence_id": "read_before_reply_email_123",
              "status": "ok",
              "step_id": "read_email_123",
              "target": "event",
              "tool_name": "gmail_read"
            },
            {
              "passed": false,
              "reason": "missing_required_action_sequence_step",
              "sequence_id": "read_before_reply_email_123",
              "step_id": "send_reply_email_123",
              "target": "episode"
            }
          ],
          "failure_ids": [
            "email_reply_completion_bad:required_action_sequences"
          ],
          "max_penalty": 30,
          "priority_band": "high",
          "priority_score": 140,
          "rule_id": "required_action_sequences",
          "rule_name": "Required Action Sequences",
          "scenario_ids": [
            "email_reply_completion_bad"
          ]
        },
        {
          "average_penalty": 30.0,
          "count": 1,
          "critical_count": 1,
          "episode_ids": [
            "email_reply_completion_bad"
          ],
          "example_evidence": [
            "reply_email_123: missing required action for type='tool_result', tool='gmail_send', status='ok', result.thread_id='email-123', result.status='sent', result.message_id={matches='^msg-email-123-'}"
          ],
          "example_evidence_refs": [
            {
              "action_id": "reply_email_123",
              "passed": false,
              "reason": "missing_required_action",
              "target": "episode"
            }
          ],
          "failure_ids": [
            "email_reply_completion_bad:required_actions"
          ],
          "max_penalty": 30,
          "priority_band": "high",
          "priority_score": 140,
          "rule_id": "required_actions",
          "rule_name": "Required Actions",
          "scenario_ids": [
            "email_reply_completion_bad"
          ]
        },
        {
          "average_penalty": 30.0,
          "count": 1,
          "critical_count": 1,
          "episode_ids": [
            "email_reply_completion_bad"
          ],
          "example_evidence": [
            "exactly_one_reply_email_123: observed 0 matching event(s); expected exactly 1"
          ],
          "example_evidence_refs": [
            {
              "actual": 0,
              "count_id": "exactly_one_reply_email_123",
              "expected": "exactly 1",
              "passed": false,
              "reason": "missing_required_event_count",
              "target": "episode"
            }
          ],
          "failure_ids": [
            "email_reply_completion_bad:required_event_counts"
          ],
          "max_penalty": 30,
          "priority_band": "high",
          "priority_score": 140,
          "rule_id": "required_event_counts",
          "rule_name": "Required Event Counts",
          "scenario_ids": [
            "email_reply_completion_bad"
          ]
        },
        {
          "average_penalty": 30.0,
          "count": 1,
          "critical_count": 1,